921,"무따르, 메쏘드 트라디쇼넬 로제 브뤼 ",프랑스,부르고뉴,168021
922,"무따르, 메쏘드 트라디쇼넬 그랑드 리저브 브뤼 나뛰르 ",프랑스,부르고뉴,168020
923,"무따르, 메쏘드 트라디쇼넬 블랑 드 블랑 브뤼",프랑스,부르고뉴,168019
924,"무따르, 펫 무 페티앙 나튀렐 로제 ",프랑스,부르고뉴,168018
925,"무따르, 펫 무 페티앙 나튀렐 샤르도네 ",프랑스,부르고뉴,168017
926,"무따르, 끌리마 드 샹파뉴 ‘빈 셴’ 브뤼 나뛰르",프랑스,꼬뜨 데 바,168016
927,"산 페드로, 1865 셀렉티드 콜렉션 피스코 배럴 에이지드",칠레,센트럴 밸리,168015
928,"필드 레코딩스, 원더월 피노 누아",미국,에드나 밸리,168014
929,"필드 레코딩스, 픽션 레드",미국,파소 로블스,168013
930,"필드 레코딩스, 픽션 화이트",미국,에드나 밸리,168012
931,"필드 레코딩스, 드라이 홉 펫 낫",미국,센트럴 코스트,168011
932,"샤또 미쉘 드 몽테뉴, 에세이",프랑스,베르쥬악,168010
933,로카 데이 로쏘 돌체,이탈리아,.,168009
934,"로카 데이 포르티, 르 뀌베 모스카토",이탈리아,마르케,168008
935,"로카 데이 포르티, 프라골리노",이탈리아,.,168007
936,"로카 데이 포르티, 브륏",이탈리아,.,168006
937,"이본 끌레제, 뫼르쏘 레 슈발리에",프랑스,뫼르소,168005
938,"이본 끌레제, 볼네이",프랑스,볼네,168004
939,"이본 끌레제, 볼네이 1er 까렐 수 라 샤펠",프랑스,볼네,168003
940,"이본 끌레제, 볼네이 1er 미땅 ",프랑스,볼네,168002
941,"이본 끌레제, 볼네이 1er 끌로 드 베르세이",프랑스,볼네,168001
942,"이본 끌레제, 볼네이 1er 레 까이에레",프랑스,볼네,168000
943,"이본 끌레제, 포마르 1er 레 뤼지앙",프랑스,뽀마르,167999
944,"이본 끌레제, 끌로 드 부조",프랑스,부죠,167998
945,"토로 알발라, 돈 피엑스 콘벤토 셀렉시온 ",스페인,몬티야 모리레스,167997
946,"베누아 라예, 로제 드 마세라시옹 엑스트라 브뤼",프랑스,몽따뉴 드 랭스,167996
947,"동-그레예, 르 몽 드 페르 로제 엑스트라 브뤼",프랑스,발레 드 라 마른,167995
948,"앙리 지로, 아르곤 로제 브뤼",프랑스,발레 드 라 마른,167994
949,"샤를 라쇼, 부르고뉴 라 크루아 블랑쉬",프랑스,부르고뉴,167993
950,"샤를 라쇼, 부르고뉴 알리고떼 레 샴 다르정",프랑스,부르고뉴,167992
951,"샤를 라쇼, 포마르 오프레 뒤 끌로",프랑스,뽀마르,167991
952,"샤를 라쇼, 즈브레 샹베르탱 엉 르니아르 ",프랑스,쥬브레-샹베르땅,167990
953,"샤를 라쇼, 볼네이 1er 레 상트노",프랑스,볼네,167989
954,"조르쥬 라발, 레 롱그 비올 브뤼 나뚜르",프랑스,샹파뉴,167988
955,"포데레 디 마르치알라, 끼안티 리세르바",이탈리아,키안티,167987
956,"포데레 디 마르치알라, 끼안티",이탈리아,키안티,167986
957,"히킨보탐, 더 피크",호주,맥라렌 베일,167985
958,"히킨보탐, 브룩스 로드 쉬라즈",호주,맥라렌 베일,167984
959,"히킨보탐, 리바이벌리스트 메를로",호주,맥라렌 베일,167983
960,"히킨보탐, 트루맨 까베르네 소비뇽",호주,맥라렌 베일,167982
961,"마르키시오, 로에로",이탈리아,랑게,167981
962,"마르키시오, 바롤로",이탈리아,바롤로,167980
963,"리버비, 싱글 빈야드 드라이 리슬링",뉴질랜드,말보로,167979
964,"레드헤즈 스튜디오, 1888  바로사 밸리 쉬라즈",호주,바로사 밸리,167978
965,"도멘 프랑소와 달렌느, 부르고뉴 샤르도네",프랑스,부르고뉴,167977
966,"도멘 프랑소와 달렌느, 부르고뉴 피노 누아",프랑스,부르고뉴,167976
967,올트레 파소,이탈리아,뿔리아,167975
968,"오이노스, 시라",이탈리아,시칠리아,167974
969,"오이노스, 피노 그리지오",이탈리아,시칠리아,167973
970,"오이노스, 네로 다볼라",이탈리아,시칠리아,167972
971,"마스카 델 타코, 루리 에디지오네 리미타타 프리미티보",이탈리아,뿔리아,167971
972,"마스카 델 타코, 리 필리띠 프리미티보 디 만두리아 리제르바",이탈리아,만두리아,167970
973,"마스카 델 타코, 루 에따 피아노",이탈리아,뿔리아,167969
974,"마스카 델 타코, 루 라빠이오 프리미티보 디 만두리아",이탈리아,만두리아,167968
975,"마스카 델 타코, 삐아노 치우소 프리미티보 디 만두리아 리제르바",이탈리아,만두리아,167967
976,"마스카 델 타코, 수수마니엘로",이탈리아,뿔리아,167966
977,"마스카 델 타코, 루 세뿌 네그로아마로",이탈리아,뿔리아,167965
978,크리스마스 아스티,이탈리아,아스티,167964
979,"다밀라노, 랑게 아르네이스 ",이탈리아,피에몬테,167963
980,"다밀라노, 바롤로 부르나테",이탈리아,바롤로,167962
981,"다밀라노, 바롤로 깐누비 리제르바",이탈리아,칸누비,167961
982,"바스티오니 델라 로카, 프리미티보",이탈리아,뿔리아,167960
983,"코투리, 브루탈",미국,소노마 밸리,167959
984,"텐 에이커, 러시안 밸리 샤도네이",미국,러시안 리버 밸리,167958
985,"부두 화이트 매직, 화이트 블렌드",미국,캘리포니아,167957
986,"맥매니스, 캘리포니아 진판델",미국,캘리포니아,167956
